{
  "kernel_version": "PRK-1.0",
  "fixture_id": "baseline",
  "dt": 0.05,
  "x": [0.90, 0.75, 0.60],
  "D": [[0.05, 0.01, 0.00], [0.00, 0.03, 0.005], [0.002, 0.00, 0.04]],
  "A": [[0.00, 0.04, 0.02], [0.03, 0.00, 0.015], [0.01, 0.025, 0.00]],
  "r": [0.08, 0.10, 0.12],
  "h": [0.03, 0.04, 0.05],
  "B": [[0.04, 0.00], [0.01, 0.03], [0.00, 0.05]],
  "u": [0.50, 0.20],
  "weights": [0.40, 0.35, 0.25]
}
